<?xml version="1.0" encoding="UTF-8"?>
<!-- edited with XMLSPY v5 rel. 3 U (http://www.xmlspy.com) by rth77 (rth77) -->
<xs:schema xmlns:xs="http://www.w3.org/2001/XMLSchema" elementFormDefault="qualified" attributeFormDefault="unqualified">
  <xs:element name="new-doc">
    <xs:annotation>
      <xs:documentation>Comment describing your root element</xs:documentation>
    </xs:annotation>
    <xs:complexType>
      <xs:sequence>
        <xs:element name="target" type="xs:string"/>
        <xs:element name="part" maxOccurs="unbounded">
          <xs:complexType>
            <xs:sequence>
              <xs:element name="source" type="xs:string"/>
              <xs:element name="container" type="xs:string" minOccurs="0"/>
              <xs:element name="query-set">
                <xs:complexType>
                  <xs:sequence>
                    <xs:element name="query" maxOccurs="unbounded">
                      <xs:complexType>
                        <xs:sequence>
                          <xs:element name="container" type="xs:string" minOccurs="0"/>
                          <xs:element name="qexp" type="xs:string"/>
                        </xs:sequence>
                      </xs:complexType>
                    </xs:element>
                  </xs:sequence>
                </xs:complexType>
              </xs:element>
            </xs:sequence>
          </xs:complexType>
        </xs:element>
      </xs:sequence>
    </xs:complexType>
  </xs:element>
</xs:schema>
